{
  "$schema": "https://json-schema.org/draft/2020-12/schema",
  "$id": "https://github.com/uxsoft/wisp-marketplace/schema/mcp.schema.json",
  "title": "Wisp marketplace MCP server",
  "description": "One MCP server in the Wisp marketplace: mcp/<id>/mcp.json. The folder name is the server's id.",
  "type": "object",
  "required": ["name", "description", "kind"],
  "properties": {
    "$schema": { "type": "string" },
    "name": { "type": "string", "minLength": 1, "description": "Display name." },
    "description": { "type": "string", "minLength": 1, "description": "One sentence on what it gives the agents." },
    "homepage": { "type": "string", "format": "uri", "description": "Where to read more." },
    "kind": { "enum": ["stdio", "http"], "description": "stdio: a local command; http: a streamable HTTP URL." },
    "command": { "type": "string", "minLength": 1, "description": "The program to run (stdio)." },
    "args": {
      "type": "array",
      "items": { "type": "string" },
      "description": "Its arguments (stdio). {input-id} is replaced with that input's value."
    },
    "url": {
      "type": "string",
      "pattern": "^https?://",
      "description": "The server's URL (http). {input-id} is replaced with that input's value."
    },
    "oauth": { "type": "boolean", "description": "The user signs in with OAuth in the browser (http only)." },
    "oauth_client_name": {
      "type": ["string", "null"],
      "description": "The client name Wisp registers under when signing in, for servers that only allow known clients."
    },
    "inputs": {
      "type": "array",
      "description": "Plain (not secret) values the user enters when adding the server.",
      "items": {
        "type": "object",
        "required": ["id", "label"],
        "properties": {
          "id": { "type": "string", "pattern": "^[a-z][a-z0-9_]*$" },
          "label": { "type": "string", "minLength": 1 },
          "description": { "type": "string" },
          "placeholder": { "type": "string" }
        },
        "additionalProperties": false
      }
    },
    "secrets": {
      "type": "array",
      "description": "Env vars (stdio) or headers (http) whose values Wisp keeps in the system keychain.",
      "items": {
        "type": "object",
        "required": ["name", "label"],
        "properties": {
          "name": { "type": "string", "minLength": 1, "description": "The env var or header name." },
          "label": { "type": "string", "minLength": 1 },
          "description": { "type": "string" },
          "link": { "type": "string", "format": "uri", "description": "Where to get the value." },
          "prefix": { "type": "string", "description": "Put before the value the user enters, e.g. \"Bearer \"." },
          "optional": { "type": "boolean", "description": "Left out when the user leaves it empty." }
        },
        "additionalProperties": false
      }
    }
  },
  "additionalProperties": false,
  "allOf": [
    { "if": { "properties": { "kind": { "const": "stdio" } } }, "then": { "required": ["command"] } },
    { "if": { "properties": { "kind": { "const": "http" } } }, "then": { "required": ["url"] } }
  ]
}
