{
  "$schema": "../../schema/mcp.schema.json",
  "name": "Atlassian",
  "description": "Jira issues and Confluence pages in your Atlassian Cloud sites.",
  "homepage": "https://www.atlassian.com/platform/remote-mcp-server",
  "kind": "http",
  "url": "https://mcp.atlassian.com/v1/mcp",
  "oauth": true
}
